Title,Preview
NASA Moves Forward With Campaign to Return Mars Samples to Earth,"During this next phase, the program will mature critical technologies and make critical design decisions as well as assess industry partnerships."
10.9 Million Names Now Aboard NASA's Perseverance Mars Rover,"As part of NASA's 'Send Your Name to Mars' campaign, they've been stenciled onto three microchips along with essays from NASA's 'Name the Rover' contest. Next stop: Mars."
A Martian Roundtrip: NASA's Perseverance Rover Sample Tubes,"Marvels of engineering, the rover's sample tubes must be tough enough to safely bring Red Planet samples on the long journey back to Earth in immaculate condition. "
The Detective Aboard NASA's Perseverance Rover,"An instrument called SHERLOC will, with the help of its partner WATSON, hunt for signs of ancient life by detecting organic molecules and minerals."
5 Hidden Gems Are Riding Aboard NASA's Perseverance Rover,"The symbols, mottos, and small objects added to the agency's newest Mars rover serve a variety of purposes, from functional to decorative."
"New Selfie Shows Curiosity, the Mars Chemist",The NASA rover performed a special chemistry experiment at the location captured in its newest self-portrait.
NASA to Reveal Name of Its Next Mars Rover,"After a months-long contest among students to name NASA's newest Mars rover, the agency will reveal the winning name — and the winning student — this Thursday. "
Newfound Martian Aurora Actually the Most Common; Sheds Light on Mars' Changing Climate,"A type of Martian aurora first identified by NASA’s MAVEN spacecraft in 2016 is actually the most common form of aurora occurring on the Red Planet, according to new results from the mission."
NASA Prepares for Moon and Mars With New Addition to Its Deep Space Network,Robotic spacecraft will be able to communicate with the dish using radio waves and lasers.
NASA to Hold Mars 2020 Perseverance Rover Launch Briefing,Learn more about the agency's next Red Planet mission during a live event on June 17.
"While Stargazing on Mars, NASA's Curiosity Rover Spots Earth and Venus",This new portrait of the Red Planet's neighbors was taken during a time when there's more dust in the air on Mars.
Mars Scientists Investigate Ancient Life in Australia,Teams with NASA's Mars 2020 and ESA's ExoMars practiced hunting for fossilized microbial life in the Australian Outback in preparation for their Red Planet missions. 
NASA's Mars 2020 Rover Closer to Getting Its Name,"155 students from across the U.S. have been chosen as semifinalists in NASA's essay contest to name the Mars 2020 rover, and see it launch from Cape Canaveral this July."
NASA's Mars Helicopter Attached to Mars 2020 Rover ,The helicopter will be first aircraft to perform flight tests on another planet.
"Heat and Dust Help Launch Martian Water Into Space, Scientists Find","Scientists using an instrument aboard NASA’s Mars Atmosphere and Volatile EvolutioN, or MAVEN, spacecraft have discovered that water vapor near the surface of the Red Planet is lofted higher into the atmosphere than anyone expected was possible. "
